{
  "id": "kbop",
  "name": "Kirklees Better Outcomes Partnership (KBOP)",
  "organisation": "Bridges Outcomes Partnerships",
  "status": "Not verified as running (web research, October 2026)",
  "open": true,
  "hwlFunded": false,
  "level": "local",
  "audience": [
    "individual"
  ],
  "categories": [
    "Finding work",
    "Staying in work"
  ],
  "whoFor": "To be completed: the October 2026 research did not confirm who this is for.",
  "age": null,
  "webpage": "https://www.kirkleesbetteroutcomespartnership.org/",
  "email": null,
  "phone": null,
  "social": [],
  "locations": [],
  "areas": [
    "Kirklees-wide"
  ],
  "eligibility": [],
  "exclusions": [],
  "gate": [],
  "healthFocus": [],
  "referralRoutes": [
    "To be completed"
  ],
  "selfReferral": {
    "allowed": "tbc",
    "note": "To be completed."
  },
  "activities": [
    {
      "name": "Kirklees Better Outcomes Partnership (KBOP)",
      "summary": "To be completed: the research found the service but did not confirm what it currently offers.",
      "duration": ""
    }
  ],
  "workExperience": "Not known",
  "notes": "Why it wasn't on the main list: Official site blocks fetching / footer 2018; job ads to Oct 2026 suggest it's running but referral rules unconfirmed; may be retendered. Directory now only describes its Dual Diagnosis team, added as 'Community Links Dual Diagnosis service'.",
  "lastUpdated": "2026-10-14",
  "reviewCycle": "Quarterly",
  "provenance": {
    "source": "Kirklees additional services spreadsheet v3 (October 2026), 'Not verified or closed' tab, row 2",
    "foundVia": "Web research or directory review (October 2026)",
    "evidence": "Official site blocks fetching / footer 2018; job ads to Oct 2026 suggest it's running but referral rules unconfirmed; may be retendered. Directory now only describes its Dual Diagnosis team, added as 'Community Links Dual Diagnosis service'.",
    "confidence": "low",
    "checkedUrl": "https://www.kirkleesbetteroutcomespartnership.org/"
  },
  "listing": {
    "decision": "review",
    "reason": "On the spreadsheet's 'Not verified or closed' tab. Not live until the details are checked and completed."
  }
}
