{
  "id": "men-walking-talking-huddersfield",
  "name": "Men Walking and Talking – Huddersfield",
  "organisation": "Men Walking and Talking",
  "status": "Not verified as running (web research, October 2026)",
  "open": true,
  "hwlFunded": false,
  "level": "local",
  "audience": [
    "individual"
  ],
  "categories": [
    "Men",
    "Mental health",
    "Wellbeing"
  ],
  "whoFor": "To be completed: the October 2026 research did not confirm who this is for.",
  "age": null,
  "webpage": "https://www.menwalkingandtalking.co.uk/walks/huddersfield-walk/",
  "email": null,
  "phone": null,
  "social": [],
  "locations": [],
  "areas": [
    "Huddersfield"
  ],
  "eligibility": [],
  "exclusions": [],
  "gate": [],
  "healthFocus": [
    "mental-health"
  ],
  "referralRoutes": [
    "To be completed"
  ],
  "selfReferral": {
    "allowed": "tbc",
    "note": "To be completed."
  },
  "activities": [
    {
      "name": "Men Walking and Talking – Huddersfield",
      "summary": "To be completed: the research found the service but did not confirm what it currently offers.",
      "duration": ""
    }
  ],
  "workExperience": "Not known",
  "notes": "Why it wasn't on the main list: Directory June 2025; not checked.",
  "lastUpdated": "2026-10-14",
  "reviewCycle": "Quarterly",
  "provenance": {
    "source": "Kirklees additional services spreadsheet v3 (October 2026), 'Not verified or closed' tab, row 31",
    "foundVia": "Web research or directory review (October 2026)",
    "evidence": "Directory June 2025; not checked.",
    "confidence": "low",
    "checkedUrl": "https://www.menwalkingandtalking.co.uk/walks/huddersfield-walk/"
  },
  "listing": {
    "decision": "review",
    "reason": "On the spreadsheet's 'Not verified or closed' tab. Not live until the details are checked and completed."
  }
}
