{
  "id": "skills-connect-wy-colleges",
  "name": "Skills Connect",
  "organisation": "West Yorkshire Colleges Consortium",
  "status": "Not verified as running (web research, October 2026)",
  "open": true,
  "hwlFunded": false,
  "level": "regional",
  "audience": [
    "individual"
  ],
  "categories": [
    "Skills",
    "Returning to learning"
  ],
  "whoFor": "To be completed: the October 2026 research did not confirm who this is for.",
  "age": null,
  "webpage": "https://www.westyorkshirecolleges.co.uk/contracted-projects/skills-connect",
  "email": null,
  "phone": null,
  "social": [],
  "locations": [],
  "areas": [
    "Kirklees-wide"
  ],
  "eligibility": [],
  "exclusions": [],
  "gate": [],
  "healthFocus": [],
  "referralRoutes": [
    "To be completed"
  ],
  "selfReferral": {
    "allowed": "tbc",
    "note": "To be completed."
  },
  "activities": [
    {
      "name": "Skills Connect",
      "summary": "To be completed: the research found the service but did not confirm what it currently offers.",
      "duration": ""
    }
  ],
  "workExperience": "Not known",
  "notes": "Why it wasn't on the main list: No course dates or funding period.",
  "lastUpdated": "2026-10-14",
  "reviewCycle": "Quarterly",
  "provenance": {
    "source": "Kirklees additional services spreadsheet v3 (October 2026), 'Not verified or closed' tab, row 10",
    "foundVia": "Web research or directory review (October 2026)",
    "evidence": "No course dates or funding period.",
    "confidence": "low",
    "checkedUrl": "https://www.westyorkshirecolleges.co.uk/contracted-projects/skills-connect"
  },
  "listing": {
    "decision": "review",
    "reason": "On the spreadsheet's 'Not verified or closed' tab. Not live until the details are checked and completed."
  }
}
