{
  "id": "learn-my-way",
  "name": "Learn My Way",
  "organisation": "Good Things Foundation",
  "status": "Not verified as running (web research, October 2026)",
  "open": true,
  "hwlFunded": false,
  "level": "national",
  "audience": [
    "individual"
  ],
  "categories": [
    "Digital skills"
  ],
  "whoFor": "To be completed: the October 2026 research did not confirm who this is for.",
  "age": null,
  "webpage": "https://www.learnmyway.com/",
  "email": null,
  "phone": null,
  "social": [],
  "locations": [],
  "areas": [
    "Online"
  ],
  "eligibility": [],
  "exclusions": [],
  "gate": [],
  "healthFocus": [],
  "referralRoutes": [
    "To be completed"
  ],
  "selfReferral": {
    "allowed": "tbc",
    "note": "To be completed."
  },
  "activities": [
    {
      "name": "Learn My Way",
      "summary": "To be completed: the research found the service but did not confirm what it currently offers.",
      "duration": ""
    }
  ],
  "workExperience": "Not known",
  "notes": "Why it wasn't on the main list: Live but provider/date not confirmed on page.",
  "lastUpdated": "2026-10-14",
  "reviewCycle": "Quarterly",
  "provenance": {
    "source": "Kirklees additional services spreadsheet v3 (October 2026), 'Not verified or closed' tab, row 18",
    "foundVia": "Web research or directory review (October 2026)",
    "evidence": "Live but provider/date not confirmed on page.",
    "confidence": "low",
    "checkedUrl": "https://www.learnmyway.com/"
  },
  "listing": {
    "decision": "exclude",
    "reason": "Not work and health related",
    "by": "PL",
    "date": "2026-10-16"
  }
}
