{
  "id": "yorkshire-wellbeing-skills-group",
  "name": "Yorkshire Wellbeing Skills Group",
  "organisation": "YWSG",
  "status": "Not verified as running (web research, October 2026)",
  "open": true,
  "hwlFunded": false,
  "level": "local",
  "audience": [
    "individual"
  ],
  "categories": [
    "Wellbeing",
    "Skills"
  ],
  "whoFor": "To be completed: the October 2026 research did not confirm who this is for.",
  "age": null,
  "webpage": "http://www.ywsg.org.uk",
  "email": null,
  "phone": null,
  "social": [],
  "locations": [],
  "areas": [
    "Kirklees-wide"
  ],
  "eligibility": [],
  "exclusions": [],
  "gate": [],
  "healthFocus": [],
  "referralRoutes": [
    "To be completed"
  ],
  "selfReferral": {
    "allowed": "tbc",
    "note": "To be completed."
  },
  "activities": [
    {
      "name": "Yorkshire Wellbeing Skills Group",
      "summary": "To be completed: the research found the service but did not confirm what it currently offers.",
      "duration": ""
    }
  ],
  "workExperience": "Not known",
  "notes": "Why it wasn't on the main list: No detail on what's current or cost.",
  "lastUpdated": "2026-10-14",
  "reviewCycle": "Quarterly",
  "provenance": {
    "source": "Kirklees additional services spreadsheet v3 (October 2026), 'Not verified or closed' tab, row 29",
    "foundVia": "Web research or directory review (October 2026)",
    "evidence": "No detail on what's current or cost.",
    "confidence": "low",
    "checkedUrl": "http://www.ywsg.org.uk"
  },
  "listing": {
    "decision": "review",
    "reason": "On the spreadsheet's 'Not verified or closed' tab. Not live until the details are checked and completed."
  }
}
