{
  "id": "maternity-action-advice",
  "name": "Maternity Action advice line",
  "organisation": "Maternity Action",
  "status": "Not verified as running (web research, October 2026)",
  "open": true,
  "hwlFunded": false,
  "level": "national",
  "audience": [
    "individual"
  ],
  "categories": [
    "Employment rights",
    "Women"
  ],
  "whoFor": "To be completed: the October 2026 research did not confirm who this is for.",
  "age": null,
  "webpage": "https://maternityaction.org.uk/",
  "email": null,
  "phone": null,
  "social": [],
  "locations": [],
  "areas": [
    "Kirklees-wide"
  ],
  "eligibility": [],
  "exclusions": [],
  "gate": [],
  "healthFocus": [],
  "referralRoutes": [
    "To be completed"
  ],
  "selfReferral": {
    "allowed": "tbc",
    "note": "To be completed."
  },
  "activities": [
    {
      "name": "Maternity Action advice line",
      "summary": "To be completed: the research found the service but did not confirm what it currently offers.",
      "duration": ""
    }
  ],
  "workExperience": "Not known",
  "notes": "Why it wasn't on the main list: Site blocks automated checks.",
  "lastUpdated": "2026-10-14",
  "reviewCycle": "Quarterly",
  "provenance": {
    "source": "Kirklees additional services spreadsheet v3 (October 2026), 'Not verified or closed' tab, row 39",
    "foundVia": "Web research or directory review (October 2026)",
    "evidence": "Site blocks automated checks.",
    "confidence": "low",
    "checkedUrl": "https://maternityaction.org.uk/"
  },
  "listing": {
    "decision": "review",
    "reason": "On the spreadsheet's 'Not verified or closed' tab. Not live until the details are checked and completed."
  }
}
